{
  "$schema": "http://json-schema.org/draft-07/schema#",
  "title": "Place",
  "description": "Somewhere named that a player cannot stand in.\n\nThe fourth tier below region -> field map -> point of interest, and the only one of the four that does not reach the game. Canon holds hundreds of named locations across six epochs -- Harappa, the Makkan Coast, the Deccan, the path to Lemuria -- and almost none of them will ever be walkable. They exist because the lore is bigger than the game and does not need the game's permission to exist.\n\n`point_of_interest` was the obvious-looking home and is the wrong one: it is keyed to a walkable `field_map`, it carries an arrival line for standing there, and it ships to the game. `settlement` keeps its narrow meaning -- somewhere people live that canon models in detail, of which there are two, each with a field map under it.\n\nThe `places` folder is in NOT_EXPORTED, and `utils/check_export_boundary.py` fails if that ever stops being true.",
  "type": "object",
  "required": [
    "id",
    "type",
    "name",
    "kind"
  ],
  "properties": {
    "id": {
      "type": "string",
      "pattern": "^place_[a-z0-9_]+$"
    },
    "type": {
      "const": "place"
    },
    "name": {
      "type": "string",
      "minLength": 1
    },
    "kind": {
      "type": "string",
      "description": "What sort of thing this is. Coarse on purpose: the distinction that matters is a city from a mountain range, not a city from a town. `plains` was added when the Hyrkanian Steppe needed a home and `frontier` would have described its politics rather than its ground. `vessel` covers a place that moves and is lived in -- the Kelpfang, the Survival Train -- because a vehicle is somewhere people are, and the Train's stated ending is that it stops and becomes a village. `peak`, `mine`, `site` and `lake` came with the Age of Machinery chart, which marks single mountains, extraction works, built sites that are neither city nor ruin, and a lava lake.",
      "enum": [
        "continent",
        "city",
        "settlement",
        "range",
        "plateau",
        "plains",
        "desert",
        "coast",
        "river",
        "sea",
        "island",
        "forest",
        "wetland",
        "frontier",
        "ruin",
        "route",
        "unknown",
        "vessel",
        "peak",
        "mine",
        "site",
        "lake"
      ]
    },
    "continent": {
      "type": "string",
      "description": "Which landmass. `jambhudweepa` is the island continent this story sits on; `mainland_asia` is across the Tethys Sea from it, and carries Harappa, Mohenjodaro and the Saraswati valley."
    },
    "region": {
      "type": "string",
      "description": "The canon region this sits in, where one applies. Many named places are outside all seven -- canon's regions cover where the story is walked, not the whole world."
    },
    "coordinates": {
      "type": "object",
      "description": "Position on the same abstract 0-100 grid the field maps use.\n\nThat grid is not geography. `field_map.schema.json` states it plainly: the layout is cataclysm-shaped, the delta maps cluster in the surviving southwest, and distance encodes how much of the world was lost. It describes the world *after* the Shattering.\n\nSo a coordinate here is a claim about one era, not about where somewhere sits forever. A place whose position is the same before and after the Collapse states it once at the top level. A place the Shattering moved states the later one in `states` -- the world fractured along tectonic and dimensional boundaries at once, and things did not stay put.\n\nAbsent means canon knows the place exists and has not placed it, which is honest and common. Everything read off dump/Partial_map.png is in that position today: the render shows a living Harappa and a standing university, so it depicts a pre-cataclysm world, and the only grid canon has is the post-cataclysm one. That gap is deliberate rather than pending -- see the Shattering ruling in DESIGN.md. An atlas leaves an unplaced place out rather than dropping it at a corner.",
      "required": [
        "x",
        "y"
      ],
      "properties": {
        "x": {
          "type": "number",
          "minimum": 0,
          "maximum": 100,
          "description": "West to east."
        },
        "y": {
          "type": "number",
          "minimum": 0,
          "maximum": 100,
          "description": "North to south, screen order -- 0 is the top. Binding ruling, DESIGN.md."
        }
      },
      "additionalProperties": false
    },
    "within": {
      "type": "string",
      "description": "What contains this place -- another place, a region, a settlement or a field map.\n\nExists because canon names far more places than it can survey. Seventeen were named by events and drawn nowhere, because only the ones legible on `dump/Partial_map.png` ever got coordinates and everything authored since has had none. Each era's chapter mentioned places the era's map did not show.\n\nPlotting each by hand does not scale and mostly invents geography. This does neither: the Nilgiri Canopy is in the Nilgiri, the Narmada University Library is on the Narmada field map, and saying so is a fact canon already holds. The atlas resolves a position from the parent and **draws it as inherited rather than surveyed** -- a hollow marker, not a filled one -- so the map never claims a precision it does not have.\n\nA place with its own `coordinates` ignores this. A place with neither is simply unplaced, which stays honest and common."
    },
    "extent": {
      "type": "array",
      "description": "The ground this covers, as a closed ring of [x, y] points on the same abstract 0-100 grid the field maps use.\n\nTraced off `dump/Partial_map.png`, which is the only picture canon has of its own geography. Approximate on purpose: it is a schematic of where things are relative to each other, not a survey, and it is read to about three units.\n\n**This is the world before the Great Shattering.** The three field-map coordinates are not on it and are not meant to be -- `field_map.schema.json` records that their layout is cataclysm-shaped, and the map's own arrangement disagrees with them: it puts Dwarka and the Narmada country at nearly one latitude where the grid spreads them from y=64 to y=20. That is the Shattering having happened in between, not an error in either.",
      "minItems": 3,
      "items": {
        "type": "array",
        "minItems": 2,
        "maxItems": 2,
        "items": {
          "type": "number",
          "minimum": 0,
          "maximum": 100
        }
      }
    },
    "path": {
      "type": "array",
      "description": "A linear feature -- a river, a route -- as an ordered list of [x, y] points on the 0-100 grid. Read source-first: the Saraswati runs from inner Asia to the Makran coast, and the order says which end is which.\n\nSeparate from `extent` because a ring and a line are different things. A river drawn as a thin polygon has to be drawn twice, once out and once back, and every edit has to keep the two banks in step.",
      "minItems": 2,
      "items": {
        "type": "array",
        "minItems": 2,
        "maxItems": 2,
        "items": {
          "type": "number",
          "minimum": 0,
          "maximum": 100
        }
      }
    },
    "epochs": {
      "type": "array",
      "description": "Epoch ids from database/timeline/epochs.json. Absent means the place exists in every era.",
      "items": {
        "type": "string"
      }
    },
    "states": {
      "type": "array",
      "description": "What changed, and when, for the few places that genuinely transform.\n\nA place states its identity once and overrides only what moved. Most places carry no states at all and are eight-line files; this exists for the handful like Dwarka, a working harbour in Civilization Dawn and a drowned gate after the Shattering.\n\nUsually what changes is a name or a status, not a position -- a city does not move. The exception is the Shattering itself, which fractured the world along tectonic and dimensional boundaries at once, so `coordinates` may be restated here for somewhere it carried with it.\n\nOne entity per place per epoch was the alternative and was rejected: it multiplies hundreds by six and makes 'is this the same place?' unanswerable.",
      "items": {
        "type": "object",
        "required": [
          "epoch"
        ],
        "properties": {
          "epoch": {
            "type": "string"
          },
          "name": {
            "type": "string",
            "description": "What it is called in this era, if that changed."
          },
          "kind": {
            "type": "string"
          },
          "coordinates": {
            "type": "object",
            "description": "Where the place sits in this era, if the Shattering moved it.\n\nUnused, and likely to stay that way. The Great Shattering is withheld on purpose -- canon keeps its consequences and not its account, because working it out is what the player is there to do. So there is no statement of what moved or how far, and there is not going to be one in `events`.\n\nThe field remains because it is the honest shape: a city does not move, but a continent that fractures takes its cities with it. If the drip through `discoveries` ever establishes where something stood before, this is where that goes.",
            "required": [
              "x",
              "y"
            ],
            "properties": {
              "x": {
                "type": "number",
                "minimum": 0,
                "maximum": 100
              },
              "y": {
                "type": "number",
                "minimum": 0,
                "maximum": 100
              }
            },
            "additionalProperties": false
          },
          "status": {
            "type": "string",
            "description": "A short state word -- drowned, ruined, founded, abandoned, buried.",
            "minLength": 1
          },
          "description": {
            "type": "string"
          },
          "notes": {
            "type": "string"
          },
          "held_by": {
            "type": "string",
            "description": "The faction that held this place in the era, when the era's map says. The Age of Machinery chart colours places by nation; this is that colour as a fact."
          },
          "confirmed": {
            "type": "boolean",
            "description": "False where the era's chart marks the place with '?': placed, but not yet settled."
          }
        },
        "additionalProperties": false
      }
    },
    "description": {
      "type": "string"
    },
    "notes": {
      "type": "string"
    },
    "aliases": {
      "type": "array",
      "items": {
        "type": "string"
      }
    },
    "canon": {
      "type": "string",
      "enum": [
        "primary",
        "secondary",
        "inferred"
      ],
      "description": "How firmly this is established. `inferred` covers everything read off dump/Partial_map.png, which is a NotebookLM render of the lore and is reference rather than authority."
    },
    "sample": {
      "type": "boolean",
      "description": "Marks this entity as a retained test fixture rather than canon.\n\nThe Dragon's Spine episode -- an event, the king who fought it, the dragon, and the range it happened in -- was written to exercise the tooling and kept on purpose, because four entities spread across four folders is a genuinely useful thing to test against. It is not part of the story.\n\nMarked on the entity rather than in a registry, so it is visible to anyone reading the file. `lint_story.py` enforces the isolation that makes it safe to keep: nothing that is not itself a sample may reference a sample, so the fixture cannot quietly become load-bearing."
    },
    "sources": {
      "type": "array",
      "items": {
        "type": "string"
      }
    }
  },
  "additionalProperties": false
}
