{
  "id": "place_ancient_courts",
  "type": "place",
  "name": "The Ancient Courts",
  "kind": "settlement",
  "description": "The seat where Prince Varunesh made the Shadow Pact, and which the pact cursed.",
  "notes": "Named only by `event_shadow_pact`, which records both the summoning of Manjalaya through a Dwarka Gate and `curse_on_ancient_courts` among its outcomes. Canon does not place it, and does not say whether the curse ever lifted.",
  "canon": "primary",
  "sources": [
    "database/events"
  ]
}
