{
  "id": "place_hattusha",
  "type": "place",
  "name": "Hattusha",
  "kind": "city",
  "continent": "mainland_asia",
  "epochs": [
    "epoch_current"
  ],
  "description": "Anatolian town of the Mittani tribes.",
  "states": [
    {
      "epoch": "epoch_current",
      "coordinates": {
        "x": 5.3,
        "y": 6.1
      }
    }
  ],
  "notes": "From the Age of Machinery chart, where it sits in 'Far North'. Its position is that era's, before the Shattering; canon states no other.",
  "canon": "secondary",
  "sources": [
    "docs/lore/world_pre_shattering_2026-09-30.json"
  ]
}
