{
  "id": "place_deccan",
  "type": "place",
  "name": "The Deccan",
  "kind": "plateau",
  "epochs": [
    "epoch_prehistoric",
    "epoch_deep_antiquity",
    "epoch_migrations",
    "epoch_civilization_dawn",
    "epoch_current",
    "epoch_post_cataclysm"
  ],
  "coordinates": {
    "x": 45,
    "y": 62
  },
  "continent": "jambhudweepa",
  "description": "The high interior south of the Narmada country.",
  "canon": "inferred",
  "sources": [
    "dump/Partial_map.png",
    "docs/lore/world_pre_shattering_2026-09-30.json"
  ],
  "notes": "Ground rather than building: it is here before anyone names it and after they stop. Ground rather than building: it is here before anyone names it and after they stop.",
  "states": [
    {
      "epoch": "epoch_current",
      "coordinates": {
        "x": 53.2,
        "y": 57.8
      },
      "description": "Uplands east of Meru, between the Narmada and Godavari."
    }
  ]
}
