{
  "id": "place_mount_meru",
  "type": "place",
  "name": "Mount Meru",
  "kind": "peak",
  "continent": "jambhudweepa",
  "description": "Sacred axis of the island, ringed by a circular railway with spokes to every mine. Excavation is underway on its northern slope.",
  "states": [
    {
      "epoch": "epoch_current",
      "coordinates": {
        "x": 41.7,
        "y": 61.5
      }
    }
  ],
  "notes": "From the Age of Machinery chart, where it sits in 'Jambhudweep – Heart'. Its position is that era's, before the Shattering; canon states no other.",
  "canon": "secondary",
  "sources": [
    "docs/lore/world_pre_shattering_2026-09-30.json"
  ]
}
